{
  "generatedAt": "2026-10-24T07:45:25Z",
  "exoplanetCount": {
    "value": 6451,
    "fetchedAt": "2026-10-24T07:45:26Z"
  },
  "distances": {
    "europa": {
      "au": 5.61492494,
      "lightSeconds": 2801.876,
      "fetchedAt": "2026-10-24T07:45:31Z"
    },
    "jupiter": {
      "au": 5.61336102,
      "lightSeconds": 2801.095,
      "fetchedAt": "2026-10-24T07:45:30Z"
    },
    "mars": {
      "au": 1.49373394,
      "lightSeconds": 745.381,
      "fetchedAt": "2026-10-24T07:45:29Z"
    },
    "mercury": {
      "au": 0.78506842,
      "lightSeconds": 391.753,
      "fetchedAt": "2026-10-24T07:45:27Z"
    },
    "moon": {
      "au": 0.00252,
      "lightSeconds": 1.257,
      "fetchedAt": "2026-10-24T07:45:29Z"
    },
    "pluto": {
      "au": 35.57502098,
      "lightSeconds": 17752.113,
      "fetchedAt": "2026-10-24T07:45:32Z"
    },
    "titan": {
      "au": 8.48551741,
      "lightSeconds": 4234.316,
      "fetchedAt": "2026-10-24T07:45:31Z"
    },
    "venus": {
      "au": 0.2728809,
      "lightSeconds": 136.169,
      "fetchedAt": "2026-10-24T07:45:28Z"
    }
  },
  "trappist1e": {
    "radiusEarth": 0.92,
    "massEarth": 0.692,
    "eqTempK": 249.7,
    "periodDays": 6.101013,
    "fetchedAt": "2026-10-24T07:45:27Z"
  }
}
